{
  "title": "Technology Radar",
  "updatedAt": "2026-02-20",
  "rings": [
    { "id": "ready", "label": "Ready", "order": 1, "color": "fill-emerald-500" },
    { "id": "test", "label": "Test", "order": 2, "color": "fill-blue-500" },
    { "id": "investigate", "label": "Investigate", "order": 3, "color": "fill-amber-500" },
    { "id": "observe", "label": "Observe", "order": 4, "color": "fill-rose-500" }
  ],
  "quadrants": [
    { "id": "politics", "label": "Politics & Society" },
    { "id": "innovation", "label": "MA01 Innovation" },
    { "id": "tech", "label": "Technology & Trends" },
    { "id": "business", "label": "Digitalization & Business" }
  ],
  "entries": [
    { "id": "ai-governance", "name": "AI Governance Act", "quadrantId": "politics", "ringId": "test", "description": "Prepare controls for AI transparency and risk classification.", "tags": ["Regulation", "AI"], "owner": "Policy Team", "lastUpdated": "2026-01-10", "links": [{ "label": "Brief", "url": "https://example.com/ai-governance" }], "maturity": "Adopting" },
    { "id": "digital-identity", "name": "Digital Identity Wallets", "quadrantId": "politics", "ringId": "investigate", "description": "Track government-backed identity wallet ecosystems.", "tags": ["Identity", "Trust"], "owner": "Gov Relations", "lastUpdated": "2026-01-14", "links": [{ "label": "Landscape", "url": "https://example.com/digital-id" }], "maturity": "Exploring" },
    { "id": "data-sovereignty", "name": "Data Sovereignty", "quadrantId": "politics", "ringId": "ready", "description": "Regional data boundaries for customer records and analytics.", "tags": ["Data", "Compliance"], "owner": "Legal Ops", "lastUpdated": "2026-01-19", "links": [{ "label": "Checklist", "url": "https://example.com/sovereignty" }], "maturity": "Operational" },
    { "id": "climate-disclosure", "name": "Climate Disclosure", "quadrantId": "politics", "ringId": "observe", "description": "Monitor ESG reporting frameworks and tooling standards.", "tags": ["ESG", "Reporting"], "owner": "Sustainability", "lastUpdated": "2026-01-20", "links": [{ "label": "Overview", "url": "https://example.com/climate" }], "maturity": "Watching" },
    { "id": "future-of-work", "name": "Hybrid Work 2.0", "quadrantId": "politics", "ringId": "test", "description": "Experiment with outcome-driven collaboration policies.", "tags": ["People", "Culture"], "owner": "HR", "lastUpdated": "2026-01-22", "links": [{ "label": "Playbook", "url": "https://example.com/hybrid" }], "maturity": "Piloting" },

    { "id": "llm-copilot", "name": "LLM Copilot", "quadrantId": "innovation", "ringId": "observe", "description": "Large language models for internal copilots and automation.", "tags": ["AI", "NLP"], "owner": "Innovation Lab", "lastUpdated": "2026-01-15", "links": [{ "label": "Docs", "url": "https://example.com/llm" }], "maturity": "Exploring" },
    { "id": "agentic-workflows", "name": "Agentic Workflows", "quadrantId": "innovation", "ringId": "investigate", "description": "Design autonomous task orchestration for back-office operations.", "tags": ["AI", "Automation"], "owner": "Innovation Lab", "lastUpdated": "2026-01-25", "links": [{ "label": "Prototype", "url": "https://example.com/agents" }], "maturity": "Lab" },
    { "id": "rapid-experiments", "name": "Rapid Experiments", "quadrantId": "innovation", "ringId": "ready", "description": "Standardize product experiments with decision templates.", "tags": ["Product", "Experiment"], "owner": "PMO", "lastUpdated": "2026-01-28", "links": [{ "label": "Template", "url": "https://example.com/experiments" }], "maturity": "Operational" },
    { "id": "design-tokens", "name": "Design Tokens", "quadrantId": "innovation", "ringId": "test", "description": "Unified design language across channels and teams.", "tags": ["Design", "Platform"], "owner": "UX Chapter", "lastUpdated": "2026-02-01", "links": [{ "label": "Figma", "url": "https://example.com/tokens" }], "maturity": "Piloting" },
    { "id": "x-reality", "name": "XR Training", "quadrantId": "innovation", "ringId": "observe", "description": "Immersive training programs for field and safety drills.", "tags": ["XR", "Learning"], "owner": "Learning Team", "lastUpdated": "2026-02-02", "links": [{ "label": "Case", "url": "https://example.com/xr" }], "maturity": "Watching" },
    { "id": "prompt-engineering", "name": "Prompt Engineering Guild", "quadrantId": "innovation", "ringId": "test", "description": "Community-led enablement for reusable prompt patterns.", "tags": ["AI", "Skills"], "owner": "Enablement", "lastUpdated": "2026-02-04", "links": [{ "label": "Guide", "url": "https://example.com/prompts" }], "maturity": "Adopting" },

    { "id": "platform-engineering", "name": "Platform Engineering", "quadrantId": "tech", "ringId": "ready", "description": "Self-service golden paths for product teams.", "tags": ["DevEx", "Cloud"], "owner": "Core Tech", "lastUpdated": "2026-01-13", "links": [{ "label": "Portal", "url": "https://example.com/platform" }], "maturity": "Operational" },
    { "id": "wasm-edge", "name": "WASM at Edge", "quadrantId": "tech", "ringId": "investigate", "description": "Evaluate low-latency edge execution for APIs.", "tags": ["Edge", "Runtime"], "owner": "Architecture", "lastUpdated": "2026-01-17", "links": [{ "label": "Benchmarks", "url": "https://example.com/wasm" }], "maturity": "Exploring" },
    { "id": "zero-trust", "name": "Zero Trust Networking", "quadrantId": "tech", "ringId": "test", "description": "Incremental migration to identity-centric network policies.", "tags": ["Security", "Network"], "owner": "SecOps", "lastUpdated": "2026-01-29", "links": [{ "label": "Roadmap", "url": "https://example.com/zero-trust" }], "maturity": "Piloting" },
    { "id": "green-compute", "name": "Green Compute", "quadrantId": "tech", "ringId": "observe", "description": "Track carbon-aware scheduling in cloud regions.", "tags": ["Cloud", "Sustainability"], "owner": "Cloud Ops", "lastUpdated": "2026-02-05", "links": [{ "label": "Research", "url": "https://example.com/green" }], "maturity": "Watching" },
    { "id": "event-streaming", "name": "Event Streaming", "quadrantId": "tech", "ringId": "ready", "description": "Domain event contracts for real-time integrations.", "tags": ["Data", "Architecture"], "owner": "Integration Team", "lastUpdated": "2026-02-06", "links": [{ "label": "Contracts", "url": "https://example.com/events" }], "maturity": "Operational" },
    { "id": "supply-ai", "name": "AI Ops for Supply Chain", "quadrantId": "tech", "ringId": "investigate", "description": "Demand forecasting and anomaly detection in logistics.", "tags": ["AI", "Supply Chain"], "owner": "Data Science", "lastUpdated": "2026-02-08", "links": [{ "label": "Pilot", "url": "https://example.com/supply-ai" }], "maturity": "Lab" },

    { "id": "process-mining", "name": "Process Mining", "quadrantId": "business", "ringId": "test", "description": "Measure and optimize end-to-end business flows.", "tags": ["Operations", "Analytics"], "owner": "Operations", "lastUpdated": "2026-01-08", "links": [{ "label": "Use cases", "url": "https://example.com/mining" }], "maturity": "Piloting" },
    { "id": "finops", "name": "FinOps", "quadrantId": "business", "ringId": "ready", "description": "Cloud cost transparency with monthly accountability loops.", "tags": ["Finance", "Cloud"], "owner": "Finance", "lastUpdated": "2026-01-09", "links": [{ "label": "Dashboard", "url": "https://example.com/finops" }], "maturity": "Operational" },
    { "id": "journey-orchestration", "name": "Journey Orchestration", "quadrantId": "business", "ringId": "investigate", "description": "Personalized customer journeys across channels.", "tags": ["CX", "Automation"], "owner": "Marketing", "lastUpdated": "2026-01-31", "links": [{ "label": "Blueprint", "url": "https://example.com/journey" }], "maturity": "Exploring" },
    { "id": "digital-twins", "name": "Digital Twins", "quadrantId": "business", "ringId": "observe", "description": "Virtual replicas for operations scenario planning.", "tags": ["Simulation", "Operations"], "owner": "Strategy", "lastUpdated": "2026-02-03", "links": [{ "label": "Concept", "url": "https://example.com/twins" }], "maturity": "Watching" },
    { "id": "knowledge-graph", "name": "Enterprise Knowledge Graph", "quadrantId": "business", "ringId": "test", "description": "Improve discoverability and context for internal decisions.", "tags": ["Data", "Search"], "owner": "Data Office", "lastUpdated": "2026-02-07", "links": [{ "label": "Model", "url": "https://example.com/graph" }], "maturity": "Adopting" },
    { "id": "workflow-automation", "name": "Workflow Automation", "quadrantId": "business", "ringId": "ready", "description": "No-code/low-code workflows for repetitive business tasks.", "tags": ["Automation", "Productivity"], "owner": "Business Systems", "lastUpdated": "2026-02-09", "links": [{ "label": "Catalog", "url": "https://example.com/workflow" }], "maturity": "Operational" },
    { "id": "customer-data-platform", "name": "Customer Data Platform", "quadrantId": "business", "ringId": "investigate", "description": "Unified audience model for activation and measurement.", "tags": ["Marketing", "Data"], "owner": "Growth", "lastUpdated": "2026-02-10", "links": [{ "label": "Evaluation", "url": "https://example.com/cdp" }], "maturity": "Exploring" },
    { "id": "digital-accessibility", "name": "Digital Accessibility", "quadrantId": "business", "ringId": "test", "description": "Embed accessibility checks in delivery lifecycle.", "tags": ["UX", "Compliance"], "owner": "Digital Office", "lastUpdated": "2026-02-11", "links": [{ "label": "Checklist", "url": "https://example.com/a11y" }], "maturity": "Adopting" }
  ]
}
